{
  "apiVersion": "v2.1.0",
  "endpoints": [
    {
      "path": "/api/health",
      "method": "GET",
      "description": "Health check endpoint"
    },
    {
      "path": "/api/users",
      "method": "GET",
      "description": "List users",
      "parameters": [
        {
          "name": "page",
          "in": "query",
          "required": false,
          "schema": {"type": "integer", "minimum": 1}
        }
      ],
      "security": ["apiKey"]
    },
    {
      "path": "/api/users/{id}",
      "method": "PUT",
      "parameters": [
        {
          "name": "id",
          "in": "path",
          "required": true,
          "schema": {"type": "string"}
        }
      ],
      "security": ["oauth2"]
    }
  ],
  "authentication": {
    "type": "oauth2",
    "config": {
      "authorizationUrl": "https://auth.example.com/oauth/authorize",
      "tokenUrl": "https://auth.example.com/oauth/token",
      "scopes": {
        "read": "Read access",
        "write": "Write access",
        "admin": "Admin access"
      }
    }
  },
  "rateLimiting": {
    "enabled": true,
    "limits": [
      {
        "path": "/api/health",
        "method": "GET",
        "maxRequests": 10000,
        "windowSeconds": 60
      },
      {
        "path": "/api/users",
        "method": "GET",
        "maxRequests": 100,
        "windowSeconds": 60
      }
    ]
  },
  "cors": {
    "allowedOrigins": ["https://example.com", "https://app.example.com"],
    "allowedMethods": ["GET", "POST", "PUT", "DELETE"],
    "maxAge": 3600
  }
}